,url,job_title,job_type,work_mode,shift,salary,company_name,company_rating,location,benefits,description,title,level,start_salary,end_salary,salary_type
160,https://www.indeed.com/viewjob?jk=b39572c2331c3255,Temporary Cyber Security Specialist (Threat Modeling and Distributed Energy Resources),Temporary Part-time,,Overtime,$15 an hour,University of North Dakota,4.2,"3851 Campus Road, Grand Forks, ND 58202",,"CATEGORIES: Other

DEPARTMENT: CEM Research Institute

Temporary Cyber Security Specialist (Threat Modeling and Distributed Energy Resources)
495308
Grand Forks, North Dakota, United States
Part-time Staff
Closing on: Sep 24 2024
Salary/Position Classification
$15.00 Hourly, Non-Exempt (Eligible for overtime)
20 hours per week
100% Remote Work Availability: No
Hybrid Work Availability: No
Purpose of Position

We are seeking a skilled part-time Cyber Security Specialist to join our dynamic team focused on securing distributed energy resources (DERs). The ideal candidate will have expertise in threat modeling, Kubernetes installation on edge devices, and proficiency in running Intrusion Detection and Prevention (IDP) tools. Additionally, the candidate will assist in literature review pertaining to Intrusion Detection and Prevention (IDP) and cloud security.

Duties & Responsibilities

Threat Modeling for Distributed Energy Resources (DERs):
Conduct thorough threat modeling exercises to identify potential vulnerabilities and risks associated with distributed energy resources.
Develop comprehensive threat models tailored to the specific requirements and configurations of DER systems.
Collaborate with cross-functional teams to integrate threat modeling into the design, development, and deployment phases of DER projects.

Kubernetes Installation on Edge Devices:
Deploy and manage Kubernetes clusters on edge devices to support the secure orchestration and management of distributed energy resources.
Configure and optimize Kubernetes environments for performance, reliability, and security.
Provide guidance and support to operational teams on best practices for maintaining Kubernetes deployments in edge computing environments.

IDU Tools Operation:
Utilize industry-standard Intrusion Detection and Prevention (IDP) tools to monitor and analyze network traffic, system logs, and other security-related data.
Investigate security incidents and anomalies detected by IDP tools, and take appropriate remedial actions to mitigate threats.
Continuously evaluate and refine IDP tool configurations to enhance detection capabilities and reduce false positives.

Literature Review of IDU and Cloud Security:
Conduct comprehensive literature reviews to stay abreast of emerging trends, technologies, and best practices in Intrusion Detection and Prevention (IDP) and cloud security.
Synthesize research findings into actionable insights and recommendations for improving the security posture of distributed energy resources and related infrastructure.
Collaborate with internal and external stakeholders to disseminate knowledge and foster a culture of continuous learning and improvement.
Required Competencies
Proficiency in operating and configuring Intrusion Detection and Prevention (IDP) tools, such as Snort, Suricata, or Zeek.
Strong analytical skills and the ability to interpret complex security-related data to identify trends, patterns, and anomalies.
Excellent written and verbal communication skills, with the ability to effectively communicate technical concepts to non-technical stakeholders.
Demonstrated ability to work independently and collaboratively in a fast-paced, interdisciplinary environment.
Minimum Requirements
B.S. or master's degree in cyber security or a related field
Proven experience in threat modeling, particularly in the context of distributed energy resources or critical infrastructure.
Hands-on expertise in deploying and managing Kubernetes clusters in edge computing environments.
Successful completion of a Criminal History Background Check

In compliance with federal law, all persons hired will be required to verify identity and eligibility to work in the US and to complete the required employment eligibility verification form upon hire. This position does not support visa sponsorship for continued employment.

Prefered Requirements

Relevant industry certifications (e.g., CISSP, CEH, CCSP) are a plus.

To Apply

Please submit cover letter and resume outlining how you meet the requirements.

Please note, all employment postings close at 11:55pm CST. Part-time/Temporary positions are posted for a minimum of 3 business days.

Find out why Grand Forks is Cooler.

All information listed in this position announcement will be used by Human Resources, the Hiring Department, and EO/Title IX for screening, interviewing and selection purposes.

Need help?

Please email the Human Resources Department at UND.humanresources@UND.edu or contact us by phone at 701.777.4226. If you anticipate needing any type of accommodation to participate in any portion of the University's employment process, including completion of the online application process, please contact our office in advance of your participation or visit.

Veteran’s Preference

Veterans claiming preference must submit all proof of eligibility by the closing date. Proof of eligibility includes a DD-214 or a copy of NGB 22 from National Guard or Reserve (with a unit located in ND) or certification from the applicant's unit command that the individual is expected to be discharged or released from active duty in the uniformed services under other than dishonorable conditions not later than one hundred twenty days after the date of the submission of the certification. If claiming disabled veteran status, proof of eligibility includes a DD-214 and a current letter of disability dated within the past year.

Confidentiality of Application Materials

Pursuant to NDCC 44-04-18.27, applications and any records related to the applications that identify an applicant are confidential, except records related to the finalists of the position, which are open to the public after the search committee has identified the top three or more finalists who will be invited to campus.

EEO Statement

The University of North Dakota is an Affirmative Action/Equal Opportunity Employer. All qualified applicants will receive consideration for employment without regard to race, color, religion, sex, sexual orientation, gender identity, national origin, disability or other protected characteristic. Women, minorities, veterans, individuals with disabilities, and members of other underrepresented groups are especially encouraged to apply. Applicants are invited to provide information regarding their gender, race and/or ethnicity, veteran’s status and disability status as part of the application process. This information will remain confidential and separate from your application.

Clery Statement

In compliance with the Jeanne Clery Disclosure of Campus Security Policy and Campus Crime Statistics Act, the University of North Dakota publishes an Annual Security and Fire Safety Report. The report includes the university’s policies, procedures, and programs concerning safety and security, as well as three years of crime statistics for our campus. As a prospective employee, you are entitled to a copy of this report. The report and statistical data can be found online at UND.edu. You may also request a paper copy of the report from the UND Police Department located at 3851 Campus Road, Grand Forks, ND, 58202.",Cyber Security Specialist,Unknown,15,15,hour
162,https://www.indeed.com/viewjob?jk=55405c757d8176da,Cyber Security Specialist (NQV),,,,,PROSOFT,4.0,"Norfolk, VA",,"Position: Cyber Security Specialist (NQV)
Location: Norfolk, VA
Salary: Competitive
Clearance: Secret
Requisition: 2024.36.3.18.03.58
The Cybersecurity Specialist will work and report directly with the Systems Engineering Site Lead, will make recommendations to stakeholders to conduct Cybersecurity and Department of Defense (DoD) Risk Management Framework (RMF) assessments to include scanning of networks with ACAS and Nessus, supporting the Change Control Board (CCB), validating RMF controls, updating POAMs, and preparing Assessment & Authorization (A&A) packages. They will validate Information Assurance controls against DOD policy standards found in 8500.2 and SP800-53 documentation, which include continuity of operations, backup recovery, and physical and virtual environments.

Job Description:
Provide Cybersecurity support to include development, writing, and reviewing A&A documentation per DOD RMF and NIST. Perform the duties of Navy Validator for accreditation submissions and assist other sites on these duties when required. Evaluate and test information systems and networks to determine compliance with cybersecurity requirements. Evaluation, test, and accredit various networks and systems to ensure full compliance with DOD requirements. Assist users with Cybersecurity related issues, and provide support as needed including auditing, contingency planning, awareness training, risk assessments, etc.
Qualifications:
At least 6 years mission critical procedures, systems, and processes, as they pertain to the command’s Information Technology and Cyber Security requirements. Experience in certifying and accrediting DON information systems and networks, as well as Platform IT.
Education:
B.S. in Cybersecurity or related field is preferred.
Certifications:
IAT Level III. CISSP or (Associate), CASP+CE, CCNP Security, CISA, GCED, GCIH, or CCEP
Registered (NQV) Navy Validator
Selected candidates must possess at least a SECRET CLEARANCE.
All candidates selected will be subject to a security background investigation.
Please visit our website, www.prosoft-eng.com for all up to date listings of all Open and Available Positions.
About us:
From our inception in 1984 to the present, we have had a single focus: to provide integrated solutions that exceed customer expectations in every performance area, by fostering an environment where PROSOFT employees continue to thrive. We are headquartered in Virginia Beach, VA, with technical engineering and administrative staff serving in locations worldwide. PROSOFT has an established reputation for providing our clients superlative support in four distinct areas of expertise: Program Management & Administrative Services, Systems & Software Engineering, Network & Infrastructure Engineering, and Training Development & Delivery.
EEOC Information
The recruitment, testing and hiring of all personnel will be without discrimination against any individual with regard to race, color, religion, gender, national origin, gender identity, disability, or protected veteran status. Attempts will be made to contact known sources of minority and women potential applicants so as to maximize the participation of such applicants.",Cyber Security Specialist,Unknown,,,
473,https://www.indeed.com/viewjob?jk=8ce337c8914396ce,Cyber Security Specialist (Financial Cyber Security),Full-time Contract,,,$75 - $80 an hour,vArida-Tech Inc.,3.5,"1 North Colorado Boulevard, Denver, CO 80206",,"Cyber Security Specialist
Location: Denver Colorado (Hybrid role)
Rate Range: $75 - $80 per hour
Open Visa (W2 Candidates)
Must have skill: Financial Cyber Security, Cyber Public Policy, Cyber Security
Job Description:
Required skills:
A broad knowledge of computer networking, log analysis, information security principles, and adversarial tools and techniques
Strong analytical skills/problem solving/conceptual thinking
Able to identify, analyze and address cyber security issues or threats, including emerging tactics or techniques
Capability to convey a cyber-security issue or threat to an external firm in a way that demonstrates how it violates the Terms of Service or Community Standards
Ability to resolve issues with minimal negative impact and risk to the organization
Confident and capable written and oral presentation skills
Strong project management skills
Ability to work independently with little oversight managing multiple investigations simultaneously
Must be comfortable in delivering messages across a wide spectrum of individuals having varying degrees of technical understanding
Must have strong leadership skills and qualities which enable you to work with peers and various levels of management
Demonstrated vendor management skills
Desired skills:
Bachelor's degree in Information Technology or related field
Experience in the remediation of information security risks/vulnerabilities
Experience with network monitoring and intrusion detection systems
Ability to work with technical and non -technical individuals
Persistent and logical investigator
Job Types: Full-time, Contract
Pay: $75.00 - $80.00 per hour
Expected hours: 40 per week
Application Question(s):
Please share your email address and prefer time to reach you
Must have skill: Financial Cyber Security, Cyber Public Policy, Cyber Security
Work Location: In person",Cyber Security Specialist,Unknown,75,80,hour
476,https://www.indeed.com/viewjob?jk=dd815e02f3ff5948,Cyber Security Specialist,Contract,,,From $75 an hour,Aloden Inc,,"Denver, CO",,"Cyber Security Specialist
Denver Colorado (Hybrid role)
Visa Open (W2 Candidates)
Must have skill: Financial Cyber Security, Cyber Public Policy, Cyber Security
Required skills:
A broad knowledge of computer networking, log analysis, information security principles, and adversarial tools and techniques
Strong analytical skills/problem solving/conceptual thinking
Able to identify, analyze and address cyber security issues or threats, including emerging tactics or techniques
Capability to convey a cyber-security issue or threat to an external firm in a way that demonstrates how it violates the Terms of Service or Community Standards
Ability to resolve issues with minimal negative impact and risk to the organization
Confident and capable written and oral presentation skills
Strong project management skills
Ability to work independently with little oversight managing multiple investigations simultaneously
Must be comfortable in delivering messages across a wide spectrum of individuals having varying degrees of technical understanding
Must have strong leadership skills and qualities which enable you to work with peers and various levels of management
Demonstrated vendor management skills
Desired skills:
Bachelor's degree in Information Technology or related field
Experience in the remediation of information security risks/vulnerabilities
Experience with network monitoring and intrusion detection systems
Ability to work with technical and non -technical individuals
Persistent and logical investigator
Job Type: Contract
Pay: From $75.00 per hour
Work Location: On the road",Cyber Security Specialist,Unknown,75,75,hour
482,https://www.indeed.com/viewjob?jk=3591ee285562ab1b,Cyber Security Specialist,Permanent Full-time,,,,"SecureSky, Inc",,"16850 Frances St, Omaha, NE 68130",,"SecureSky offers services that lower cyber risk and streamline security threat detection and response.
This position is a full-time permanent position in our Omaha, Nebraska office.
The successful candidate will provide exposure and threat analysis to clients to prevent and mitigate cyber attacks and will contribute to building on SecureSky’s proprietary methodologies.
Responsibilities:
Responsibilities include:
Responding to security alerts.
Threat and exposure hunting.
Determining risk based on the threat landscape, user actions and other XDR-based indicators, threat intelligence signals, and knowledge of client environments.
Developing SIEM and CTEM (Continuous Threat Exposure Management) content and processes to apply across SecureSky clients.
Advancing one or more SecureSky consulting practice areas, for example, XDR (security control and policy development), security automation, or vulnerability management.
Preferred Skills and Experience:
Skills and experiences that would be beneficial for this role include:
Bachelor’s degree or equivalent, with a concentration or substantial coursework in cybersecurity.
Understanding of common cybersecurity attack vectors, threat intelligence parameters, and security technologies.
One to three years of practical experience in threat investigations, incident response, and/or deployment of XDR tools.
Strong verbal and written skills for effective client communications and internal documentation, with a desire to closely interact with clients.",Cyber Security Specialist,Unknown,,,
484,https://www.indeed.com/viewjob?jk=74fb6ca123b4ce28,Cyber Security Specialist,Full-time,,Monday to Friday,,Carisam,3.2,"10900 NW 27th St, Doral, FL 33172",,"It is important to note that this position is only available on-site and cannot be accessed remotely or hyper-local.

Cyber Security Specialist

Department: MIS Department Job Status: Full Time

FLSA Status: Salaried Exempt Reports to: IT Manager

Work Schedule: Monday-Friday 8:00 A.M. - 5:00 P.M. Positions Supervised: n/a
Schedule may pass scheduled times due to demands and volume

POSITION SUMMARY:
The Cyber Security Specialist will be responsible for the internal and external security of the organization’s information systems. Plan, implement, upgrade, or monitor security measures for the protection of computer networks and information. Assess system vulnerabilities for security risks and propose and implement risk mitigation strategies. May ensure appropriate security controls are in place that will safeguard digital files and vital electronic infrastructure. May respond to computer security breaches and viruses. The Cyber Security Specialist will plan and design security solutions along with the IT Manager and capabilities that enable the organization to identify, protect, detect, respond, and recover from cyber threats and vulnerabilities. Defines and develops security requirements using risk assessments, threat modeling, testing, and analysis of existing systems. Develops security integration plans to protect existing infrastructure and to incorporate future solutions. Assists in the creation of action plans for policy creation and governance, system hardening, monitoring, incident response, disaster recovery, and emerging cybersecurity threats. Utilizes security information and event management (SEIM), data loss prevention (DLP), intrusion prevention systems (IPS), and other tools in action plan designs. Reviews current modules and systems to ensure consistency and compliance with the organization's guidelines, policies, and standards. Keeps abreast of the latest cyber threat information.

ESSENTIAL FUNCTIONS:
Provides support to the IT Manager with the organization security incident response procedures
Facilitates and manages the development, modification, and operation of security protocols including intrusion detection and prevention systems to protect the organization’s information from breach or loss.
Conducts periodic audits and due diligence checks of security protocols, evaluating systems for vulnerabilities.
Recommends modifications to security protocols as required.
Develop plans to safeguard computer files against accidental or unauthorized modification, destruction, or disclosure and to meet emergency data processing needs.
Develops and/or provides training and guidance on acceptable use, risk management, incident response, and security protocols to employees.
Periodically provides IT Manager and/or Department Head briefs status of security system and protocols.
Reviews reports of, and evaluates response to, any security incidents.
Monitor current reports of computer viruses to determine when to update virus protection systems.
Ensures that monitoring operations comply with all applicable government regulations and standards.
Encrypt data transmissions and erect firewalls to conceal confidential information as it is being transmitted and to keep out tainted digital transfers.
Maintains current knowledge of emerging security threats, technical challenges, and developments in system protection and IT security standards.
Performs other related duties as assigned.
Perform risk assessments and execute tests of data processing system to ensure functioning of data processing activities and security measures.
Modify computer security files to incorporate new software, correct errors, or change individual access status.
Access Security Providers, make recommendation of outsourcing security

KNOWLEDGE, SKILLS, & ABILITIES:
Disaster Recovery Planning| Cybersecurity| Data Loss Prevention| Encryption| Incident Management Information Security Governance| Network Security | Requirements Analysis | Security Architecture and Models| Threat Modeling | Vulnerability Assessment |Technical Project Management Risk Identification Model| Data Security Software| Firewall and other Security Hardware| Security Information and Event Management (SIEM) Software| Web Security Software
To convey in leading and guiding a team.
Demonstrated problem-solving and analytical skills.
Excellent verbal and written communication skills.
Proficient, or able to gain proficiency with, a broad array of security software applications and tools.
Proficient with Microsoft Office Suite or related software needed to maintain reports and records.
Organized with attention to detail.
Develop computer or information security policies or procedures.
Update knowledge about emerging industry or technology trends
implement security measures for computer or information systems.
Collaborate with others to resolve information technology issues.
Test computer system operations to ensure proper functioning.
Critical Thinking — Using logic and reasoning to identify the strengths and weaknesses of alternative solutions, conclusions, or approaches to problems.
Computers and Electronics — Knowledge of circuit boards, processors, chips, electronic equipment, and computer hardware and software, including applications and programming.
Engineering and/or Technology — Knowledge of the practical application of engineering science and/or technology. This includes applying principles, techniques, procedures, and equipment to the design and production of various goods and services.
Deductive Reasoning — The ability to apply general rules to specific problems to produce answers that make sense.
Inductive Reasoning — The ability to combine pieces of information to form general rules or conclusions (includes finding a relationship among seemingly unrelated events).
Problem Sensitivity — The ability to tell when something is wrong or is likely to go wrong. It does not involve solving the problem, only recognizing that there is a problem.
Attention to Detail — Job requires being careful about detail and thorough in completing work tasks.
Dependability — Job requires being reliable, responsible, and dependable, and fulfilling obligations.
Integrity — Job requires being honest and ethical.
Analytical Thinking — Job requires analyzing information and using logic to address work-related issues and problems.
Cooperation — Job requires being pleasant with others on the job and displaying a good-natured, cooperative attitude.

Education and Experience: Bachelor’s degree in computer science, Information Management, engineering or equivalent required; master’s degree preferred. Minimum of 7 years of overall experience in computer systems specializing in computer security, protection, software security, safeguarding, cyber threats and recovery. Certified Information Security Manager (CISM) | Certified Information Systems Security Professional (CISSP) is a plus. English & Spanish languages required.

PHYSICAL DEMANDS:
Prolonged periods sitting at a desk and working on a computer.
Must be able to lift up to 15 pounds at times.

WORK ENVIRONMENT
Working conditions are good. Physical demand is normal and that of regular office conditions such as sitting, standing and walking.

Sedentary work. Exerting up to 50 pounds of force occasionally and/or negligible amount of force frequently or constantly to lift, carry, push, pull or otherwise move objects.

VISUAL ACUITY

The worker is required to have close visual acuity to perform an activity such as: preparing and analyzing data and figures; transcribing; viewing a computer terminal; and extensive reading.

Department Head: _________________________ Date: _________________________

Department Manager: _________________________ Date: _________________________

Approval Signature: ______________________________ Date: ____________________________________
Director of Human Resources

The company has reviewed this job description to ensure that essential functions and basic duties have been included. It is not intended to be construed as an exhaustive list of all functions, responsibilities, skills and abilities. Additional functions and requirements may be assigned by supervisors as deemed appropriate.

I acknowledge receipt of the job description. It has been reviewed with me by my supervisor I understand should I have any questions regarding my duties, I will consult with my supervisor and/or the Human Resources Department.

Employee: ___________________________________ Date: ____________________________________
(Print Name)

Employee: ___________________________________
(Signature)",Cyber Security Specialist,Unknown,,,
