,url,job_title,job_type,work_mode,shift,salary,company_name,company_rating,location,benefits,description,title,level,start_salary,end_salary,salary_type
19,https://www.indeed.com/viewjob?jk=34ed43c8670c646f,Cyber Security Specialist,Full-time,,8 hour shift Day shift Monday to Friday,"$65,000 - $85,000 a year",Intrada Technologies,,"31 Ashler Manor Drive, Muncy, PA 17756","Dental insurance,Flexible schedule,Health insurance,Life insurance,Paid holidays,Paid time off,Professional development assistance","Intrada is actively seeking a qualified Cyber Security Specialist to join our Network Support team in both a security role but also a support role. This position offers an exciting opportunity to play a crucial role in safeguarding our digital assets and ensuring the security of our clients infrastructure. We are looking for individuals with expertise in threat analysis, vulnerability assessment, and incident response to help us navigate the evolving landscape of cyber threats.
As a Cyber Security Specialist, your primary responsibilities include identifying, assessing, and mitigating potential security risks to protect the organization’s information and technology systems. You will monitor network traffic for unusual activity, implement security protocols, and conduct regular vulnerability assessments to uncover any weaknesses in our defenses. Additionally, you will respond to security incidents, conduct forensic investigations, and ensure compliance with relevant regulations and industry standards. By collaborating with various teams, you will help educate staff on best practices for data protection, fostering a culture of security awareness throughout the organization.
In addition to cyber security responsibilities, this role works in conjunction with the Network Support team to ensure that clients' networks are both secure and stable. You will collaborate closely with network engineers and help desk teams to assess and enhance the overall performance of network systems, implementing security measures that do not hinder operational efficiency. This entails performing regular system updates, conducting performance monitoring, and troubleshooting any network-related issues that may arise. By integrating security best practices with network management, you will help create a resilient infrastructure that meets the comprehensive needs of our clients, ensuring uninterrupted service while safeguarding against potential threats.
About Intrada
Intrada Technologies is a full-service IT, web development and network management company that uses technology, problem-solving, innovation and collaboration to ensure our clients have what they need to run their businesses. Intrada isn’t a typical IT firm. We focus on creating ongoing, trusted partnerships with each of our clients through our friendly and professional staff. Every day is different with new challenges.
We ground our team-oriented approach in best practices and excellent customer service to exceed expectations of our clients - enabling many to continue providing services to other community members.
Since Intrada prioritizes ongoing client relationships, we are selective about who we take on as clients and team members. We look for clients that value our services, delivery and team members who deliver excellent customer service and exceed expectations.
Giving back to the community is a big part of our culture. We support and encourage volunteering and give of our time and funds for causes that matter. Many of the clients we serve are those that serve and support those in need in our communities.
Intrada Technologies serves clients in the state of Pennsylvania and across the country.
Pay, Benefits, & Perks
This position is located at our beautiful, rural Muncy, Pennsylvania location in a modern, collaborative office setting. The Networking and Help Desk team are fully on-site to provide support, mentoring, and teamwork opportunities.
We understand salary is very important and pay based on the quality of work delivered and how well our customers are supported by your work. Our pay scale is based on industry standards and ranges based upon experience, education, and certifications. Growth opportunities are available.
We offer group health and dental insurance, as well as employer-matched retirement plans, paid vacation, holidays and flexible schedules to support families.
Intrada balances our hard work with fun team appreciation events throughout the year - like cookouts, Friday tacos and margaritas, holiday parties and even an occasional Magic: The Gathering tournament.
Responsibilities
Monitor network infrastructures for security threats and unauthorized access.
Identify compromised devices and report on the security measures implemented to address these threats.
Analyze security risks and develop effective response procedures.
Review and Verify that security protocols and software are in place based on client configurations and service contracts.
Conduct and manage incident response processes that might include, installing security software, conduct audits, prepare status reports, educate users on computer security, create user documentation, assist in disaster recovery, and gather evidence related to cybercrimes.
Perform risk assessments on systems, maintain firewalls, update security procedures, and oversee overall system monitoring.
Research, evaluate, recommend, and implement additional security devices as needed.
Additional responsibilities may include developing and testing software deployment tools, firewalls, and intrusion detection systems.
Troubleshoot technical challenges, identify opportunities for process improvement, and implement innovative solutions to address issues.
Provide exceptional customer service and collaborative team interaction to exceed clients' expectations through phone, remote sessions, and email communication.
Work with Intrada Senior Team on the development and management of Cyber Security processes throughout the organization and for clients.
Requirements
Must be able to work safely following company policy and procedures.
Bachelor's degree in a computer-related field or relevant degree programs including cybersecurity, computer science, information technology and information management systems.
Education or Certification: Microsoft 365 Certified Administrator or Security certifications or roles. Cisco Certified Network or Security certifications. Microsoft Azure or Cybersecurity Architect Expert certification. CompTIA Security+ or other relevant cyber security certifications.
Able to travel to client sites and lift/carry 35 lbs. – overnight trips only if necessary.
All employees must pass a drug test and clear a security background check.
Preferred experience: 4 years.
Job Type: Full-time.
Schedule: Monday to Friday, 8-hour day shift.
Office: Muncy, PA.
Salary: $65,000 - $85,000 / year. Commensurate with education, certifications, and professional experience.
Benefits
Dental insurance
Flexible schedule
Health insurance
Life insurance
Paid time off
Professional development assistance
Retirement plan
We appreciate your interest in Intrada Technologies. We eagerly anticipate the opportunity to meet you. At Intrada, we are committed to providing equal opportunities to all individuals.",Cyber Security Specialist,Unknown,65000,85000,year
21,https://www.indeed.com/viewjob?jk=c1f77b9b188ea6b6,Cyber Security Specialist,Full-time,,Monday to Friday,,"Command Cyber Solutions, LLC",,"Portsmouth, VA",,"Cyber Security Specialist
Location: Portsmouth, VA
FLSA Classification: Exempt - Salaried
Employment Class: Full Time Regular
Position Summary
Command Cyber Solutions (a federal government contractor) is seeking a qualified Cyber Security Specialist who has IT experience with Cyber Security Policy and threat mitigation. You will have IT experience in all aspects of Cyber Security with a vast array of IT systems involving end user as well as enterprise level networks. You must have knowledge and experience in Cyber Security Tools, network topologies, intrusion detection, PKI, and secured networks. You must have knowledge of implementation and security levels and roles necessary for successful deployment. Last, you must possess a high level of expertise in developing long term strategies and be knowledgeable about various cyber threats and their mitigation.

Essential Duties & Responsibilities:
Responsible for defining, coordinating, monitoring hospital information system security environment, and investigating suspected violations of information security policies.
Provide support to client server environment through research, testing, and evaluation of computer security products and procedures to provide a reliable and secure computing environment. Consult with site staff to collect all system-related information necessary to prepare for intrusion detection system installation, configuration, and maintenance.
Assess site systems for the appropriate network and operating system software version levels and research and recommend appropriate patch levels as required.
Demonstrate the operation and management of the intrusion detection system.
Review current and future network security designs and recommend secure configurations to appropriate administrators.
Monitor corporate network ingress and egress points for potential intrusions or other unsolicited connection attempts.
Assist in the development, periodic review, and implementation of IMD security policies/guidelines /standard as requested by site staff.
Design and implement defense-in-depth security procedures that utilize firewalls, host and network-based intrusion detection systems, and other security devices to ensure the highest levels of security are maintained.
Determine applicability, system responsibility, and required compliance procedures for DOD IAVA and reports compliance status to command designated reporting agent.
Apply oral and written communication skills, and time management and analytical skills in daily duties.

Education, Experience & Certification Requirements

Education:
Preferred bachelor’s degree in a related field, such as computer science, information technology, or engineering. Experience can substitute for education
Experience:
Five (5) years of experience with information assurance, engineering, or operational support to the DoD, including supporting information operations, Cyber operations, system administration, and systems security
Five (5) years of experience with a DoD certification and accreditation program, including developing or analyzing security test and evaluation reports
Experience with evaluating information assurance (IA) compliance of a system against current RMF and DoD Cybersecurity policies
Experience in working with the Enterprise Mission Assurance Support Service (eMASS)
REQUIRED CERTIFICATION (at a minimum):
DoD 8570, DoD 8140.01M IAT Level II certification
CompTIA Security+ certification
Knowledge, Skills & Abilities:
Knowledge of applicable regulations, including DoD 8500.02, DoD 8510, NIST SP 800, 37, NIST SP 800, 53 or 53A, NIST 800 53-r4, NIST SP 800, 30, or CNSSI 1253
Working Conditions/Working Environment/Physical Demands
Basic office work environment at government facility location
Hours of operation are M-F between 0600-1800.
Occasionally, project requirements may require temporary adjustment of work hours/days
Duties are subject to change based on the needs of the customer
#ClearanceJobs
Command Cyber Solutions is an equal opportunity employer and is committed to providing a workplace free from harassment and discrimination. We celebrate the unique differences of our employees because that is what drives curiosity, innovation, and the success of our business. We do not discriminate on the basis of race, religion, color, national origin, gender, sexual orientation, gender identity or expression, age, marital status, veteran status, disability status, pregnancy, parental status, genetic information, political affiliation, or any other status protected by the laws or regulations in the locations where we operate. Accommodations are available for applicants with disabilities.",Cyber Security Specialist,Unknown,,,
26,https://www.indeed.com/viewjob?jk=505dba7a93785f2a,IT Cyber Security Specialist,Full-time,,,,BlueOval SK,1.0,"Glendale, KY","401(k) matching,AD&D insurance,Dental insurance,Disability insurance,Employee discount,Flexible spending account,Health insurance","IT Cyber Security Specialist– Battery Manufacturing
Introduction to BlueOval SK
At BlueOval SK, we will lead the transformation of the electric vehicle (EV) battery business through partnership (Joint Venture formed by Ford and SK On) to provide products and processes to increase our customers’ experience. As the future of BlueOval SK, you will help lead the battery revolution by working alongside our teams as we build the batteries required for electric vehicle business excellence.
Ford and SK On are investing billions in Kentucky and Tennessee including building three state-of-the art battery manufacturing facilities between the two campuses at BlueOval City in Tennessee and Blue Oval SK Battery Park in Kentucky. These brand-new advanced manufacturing facilities will use Ford’s 100-years of automobile manufacturing expertise and SK On’s 30+ years of electric vehicle battery expertise to become the world’s best battery manufacturer.
The IT Cyber Security Specialist at Blue Oval SK – Battery Partk in Glendale, Kentucky will work as a part of a team to protect important information assets from cyber-attacks and maintain sensitive and confidential information.
Key Areas of Responsibility:
Safeguards information system assets by identifying and solving potential and actual security problems.
Protects system by defining access privileges, control structures, and resources.
Recognizes problems by identifying abnormalities; reporting violations.
Implements security improvements by assessing current situation; evaluating trends; anticipating requirements.
Determines security violations and inefficiencies by conducting period audits.
Upgrades system by implementing and maintaining security controls.
Keeps users informed by preparing performance reports; community system status.
Maintains quality service by following organization standards.
Maintains technical knowledge by attending educational workshops; reviewing publications.
Contributes to team effort by accomplishing related results as needed.
Security systems operation/management
Security systems trouble shooting
Test new security IT system.
Install security system.
Maintain security IT system
Basic knowledge of cyber security
Knowledge of networking fundamentals (TCP/IP, Network Layers, etc.)
Knowledge of windows and Linux command skill
Minimum Requirements
Bachelor's degree in computer science or closely related field
3 + years direct hands-on experience with incident management and response
Proficiency in problem-solving, analytical thinking, and penetration testing methodologies
Advanced certifications such as SANS GIAC/GCIA/GCIH, CISSP or CASP and / or SIEM – specific training and certification.
Advanced understanding of TCP/IP, common networking ports and protocols, traffic flow, system administration, OSI model, defense-in-depth and common security elements.
Hands-on experience analyzing high volumes of logs, network data (e.g. netflow, FPC), and other attack artifacts in support of incident investigations
Experience with vulnerability scanning solutions
Proficiency with any of the following; Anti-Virus, HIPS, ID/PS, Full Packet Capture, Host-Based Forensics, Network Forensics, and RSA Security.
In-depth knowledge of architecture, engineering, and operations of at least one enterprise SIEM platform (e.g. Nitro/McAfee Enterprise Security Manager, ArcSight, QRadar, LogLogic, Splunk).
Experience developing and deploying signatures (e.g. YARA, Snort, Suricata, HIPS)
Understanding of mobile technology and OS (i.e. Android, iOS, Windows), VMware technology, and Unix and basic Unix commands.
Experience in IT security solution operation
Experience in IT Network operation
Experience in operating endpoint security solutions.
Preferred Qualifications
Bachelor’s degree in Computer Science or cybersecurity related field.
Master’s degree in cybersecurity, or related field is a plus.
Holds certifications such as: CISSP, CISA, ISO 27001
Up to date on current cybersecurity trends, threat landscape and security solutions.
About BlueOval SK
At BlueOval SK, we will lead the transformation of the electric vehicle (EV) battery business through partnership (Joint Venture formed by Ford and SK On) to provide products and processes to increase our customers’ experience. As the future of BlueOval SK, you will help lead the battery revolution by working alongside our teams as we build the batteries required for electric vehicle business excellence. We have a wide variety of opportunities for you to accelerate your career.
The Opportunity
Ford and SK On are investing billions in Kentucky and Tennessee including building three state-of-the art battery manufacturing facilities between the two campuses at BlueOval City in Tennessee and BlueOval SK Battery Park in Kentucky. These brand-new advanced manufacturing facilities will use Ford’s 100-years of automobile manufacturing expertise and SK On’s 30+ years of electric vehicle battery expertise to become the world’s best battery manufacturer.
For more information about BlueOval SK plans, please
Follow this link.
What you’ll receive in return:
As part of the BlueOval SK family, you’ll enjoy excellent compensation and a comprehensive benefits package that includes generous paid time off (PTO), retirement contributions, incentive compensation and much more. You’ll also experience exciting opportunities for professional and personal growth and recognition. If you have what it takes to help us lead the transformation of the EV battery business, we’d love to have you join us.
Benefits Include:
401k plan with retirement planning services
401k company matching after completing three months of service
Medical and prescription drug coverage
Dental and vision coverage
Preventative Care
Eligibility for great ancillary benefits including: Flexible Spending Accounts (FSAs), Short-Term Disability (STD) and Long-Term Disability (LTD), Employee Basic Life and Accidental Death Dismemberment (AD&D) insurance, and Employee Supplemental Life Insurance
Access to Paid Time Off (PTO) after completing probationary period and Emergency PTO
Parental Leave
Access to Ford Vehicle Discount Program
Climate-controlled working environment
For a full list of benefits, visit our website:
https://blueovalsk.com/opportunities

Candidates for positions with BlueOval SK must be legally authorized to work in the United States. BlueOval SK does not sponsor employment VISAs for candidates at this time. Verification of employment eligibility will be required at the time of hire.
We are an Equal Opportunity Employer committed to a culturally diverse workforce. All qualified applicants will receive consideration for employment without regard to race, religion, color, age, sex, national origin, sexual orientation, gender identity, disability status or protected veteran status.",Cyber Security Specialist,Unknown,,,
