,url,job_title,job_type,work_mode,shift,salary,company_name,company_rating,location,benefits,description,title,level,start_salary,end_salary,salary_type
0,https://www.indeed.com/viewjob?jk=dc076e9ab4f25927,Cyber Security Specialist,Full-time,Hybrid work,,"$103,500 - $122,900 a year",Colorado Springs Utilities,3.2,"Colorado Springs, CO","401(k),Dental insurance,Disability insurance,Employee assistance program,Flexible spending account,Gym membership,Health insurance","Job Type: Information Technology
Pay Range $103,500 to $122,900
Location Colorado Springs, CO
Date First Posted 9/18/24
Applications are being accepted through:
If no date is displayed, applications are being accepted on an ongoing basis; however, this job posting may close at any time after a minimum of 5 days of being posted.
Cybersecurity Specialist - Vulnerability Management
Please note that this position offers a hybrid work schedule (i.e., blend of working onsite and remote) after successfully completing probation (six months).
Our Information Security team is responsible for ensuring the confidentiality, integrity, and availability of electronically-stored data for our four-service utility. We are hiring a Cybersecurity Specialist - with an emphasis in vulnerability management - to develop and maintain vulnerability management policies, procedures, and standards.
A day in the life of a Cybersecurity Specialist may include:
Providing support to design, develop, and engineer solutions that meet network, system, or application security requirements
Conducting in-depth vulnerability assessments and monitoring for end-of-life systems and applications
Collaborating with system administration and application teams to verify plans and proposed implementations to mitigate vulnerabilities and manage secure images
Managing toolsets and solutions for effective enterprise-level vulnerability management
Creating reports and dashboards of the current state of known organization-wide vulnerabilities and mitigation trends
Continuously measuring and monitoring vulnerability information quality and adjusting to account for changes in technology, standards, or operating environments
Assisting in managing and monitoring alerts in the Web Application Firewall (WAF) to protect web applications from threats
Staying up-to-date with the latest security trends, vulnerabilities, and threat intelligence
Providing guidance and training to internal teams on vulnerability management best practices
Please note that this position requires the successful candidate to participate in the Cybersecurity Incident Response Team which may require activation outside of normal working hours.
Who You Are
Demonstrated cybersecurity experience (typically 3+ years), preferably within information security or vulnerability management
Bachelor's Degree in Cybersecurity, Information Technology, Control Systems, or a related field is valued
Certifications in any of the following are valued :
Security+ Network+ ISC2Certified Information Systems Security Professional (CISSP)
Offensive Security Certified Professional (OSCP)
Governance, Risk and Compliance (GRC)
Who We Are
One of the largest four-service public utilities in the nation (over 500,000 customers)
A national leader in reliability (power on an average of 99.991% of the time)
Diamond Designation recipient from the American Public Power Association – a utility leader in reliability, safety, workforce development, and system improvements
Located at the base of the Rocky Mountains in the #3 best city to live in the United States (U.S. News & World Report, 2024)
Our Commitment to Our Employees
Our people are the heart and soul of Colorado Springs Utilities. They keep the lights on, gas flowing, water coming in, and wastewater leaving. We do not just say people are important – we prove it! That’s why we are honored to invest in protecting the health and financial security of our employees and their families through our rich benefits program.
Time Off – Because everybody needs time off to recharge
Vacation – New employees accrue 13 days of paid time off to start, while our more tenured employees accrue 24 days per year
Personal Leave –3 days per year of personal leave
Paid Holidays –12 paid holidays per year
Sick Leave – Accrue 12 days of sick leave annually for those days when you or a family member is feeling under the weather
Vacation Buy – Purchase up to 40 hours of additional vacation time
Pension Plan – Looking forward to a comfortable lifestyle once you’re done working? The Colorado Public Employees’ Retirement Association (PERA) provides you with retirement benefits and peace of mind when you retire
Medical – Select from three comprehensive medical plans, starting at $0 per month. Employees also enjoy access to a Health Savings Account (HSA) and Flexible Spending Account (FSA). (effective the 1st of the month following your start date)
Wellness Program – Voluntary wellness program that allows you and your spouse to each earn up to $500 to use towards healthcare expenses, $100 in Visa gift cards, and up to $400 in gym membership reimbursements
Dental – Select from two dental plans, with in-network PPO preventive care covered at 100% and access to orthodontia coverage (effective the 1st of the month following your start date)
Vision – Voluntary plan that covers full vision care services and discounts on LASIK eye surgery (effective the 1st of the month following your start date)
Retirement Saving Programs – Supplement your pension plan with voluntary retirement programs such as the PERAPlus 401(k) and MissionSquare’s Roth IRA and 457 plans
Disability Coverage – Short-Term (STD) and Long-Term Disability (LTD) insurance available for purchase (effective the 1st of the month following your start date)
Employee Assistance Program (EAP) – Makes the going a little easier by aiding with mental health, stress management, work-life balance, financial and legal matters, and much more
Long-Term Care Insurance (LTC) – Whether it's due to an accident or a serious illness, LTC insurance is available for purchase to help you and your loved ones (effective the 1st of the month following your start date)
Life Insurance – Company-paid life insurance and supplemental coverage available (effective the 1st of the month following your start date)
Tuition Reimbursement – Employees are eligible to receive up to $5,250 annually for Tuition Reimbursement
Qualifying Public Service Employer – Payments made towards student loans may qualify for the Public Service Loan Forgiveness Program
ATTENTION :
All positions will be posted for a minimum of 5 calendar days.
Starting pay will be determined within the posted pay range based on the experience, education, and training of the successful candidate; if there is a single pay rate posted, the job starts at that rate.
Colorado Springs Utilities does not sponsor work visas of any kind (including but not limited to F-1, H-1B, or TN visas with a STEM OPT extension). Eligible applicants must be authorized to work in the United States.
Colorado Springs Utilities is an Equal Employment Opportunity/Affirmative Action employer. Our differences make us richer. Learning and growing from one another makes us more than what we were. We want our workforce to be as diverse as our business and recognize the limitless benefits of this commitment. Our desire is to have the organization reflect the diversity of the Pikes Peak Region. As an Equal Employment Opportunity employer, it is our commitment that no person shall be unlawfully discriminated against because of race, color, national origin or ancestry, sex, age, religious convictions, veteran status, disability, political beliefs, sexual orientation, or gender identity. Affirmative Action is Colorado Springs Utilities’ effort to ensure positive steps are taken to have a representative workforce reflective of the relevant available labor force.
For more information regarding applicant rights, visit https://www.dol.gov/ofccp/regs/compliance/posters/ofccpost.htm
Accessibility Accommodations . If you are an individual with a disability or disabled veteran who is unable to use our online tools to search and apply for jobs, you may request a reasonable accommodation by contacting us at accessibility@csu.org or by calling 719-668-7500. This option is reserved for individuals who are unable to use or require assistance with the online tools as the result of a disability and is not intended for other purposes.
E-Verify and Right to Work Notice . Federal law requires all employers to verify the identity and employment eligibility of all persons hired to work in the United States. Colorado Springs Utilities participates in E-Verify. For more information on your rights and responsibilities as an applicant, please visit: http://coloradospringsutilities.jobs/applicants-rights-and-responsibilities/ . If you have a legal right to work in the United States, there are laws to protect you against discrimination in the workplace. You should know that no employer can deny you a job or fire you because of your national origin. Unless mandated by law or government contract, employers cannot require you to be a U.S. Citizen or permanent resident or refuse any legally acceptable documents. If any of these things have happened to you, you may have a valid charge of discrimination that can be filed with the OSC. Contact the OSC for assistance in your own language. Call 1-800-255-7688. TDD for the hearing impaired is 1-800-237-2515. In the Washington, D.C., area, please call 202-616-5594, TDD 202-616-5525 Or write to: U.S. Department of Justice Office of Special Counsel NYA 950 Pennsylvania Ave., N.W. Washington, DC 20530.
Have a question? If you have a question about a position or need assistance from a recruiter, email us at csurecruiting@csu.org or call 719-668-7500.
Job Type: Information Technology",Cyber Security Specialist,Unknown,103500,122900,year
1,https://www.indeed.com/viewjob?jk=b7c961acc9357283,Cyber Security Specialist,Full-time,,Weekends as needed Evenings as needed,,Texas Southmost College,3.7,"80 Fort Brown St, Brownsville, TX 78520",,"Job Summary
The Cybersecurity Specialist reports directly to the Chief Information Security Officer (CISO) and assists with the design, deployment, and oversight of the College’s Information Technology Cybersecurity Program to ensure all aspects are complete, current and in adherence with regulatory requirements and institutional objectives. The cybersecurity program will include development of security policies, guidelines, templates and other documentation, ongoing risk assessments to include the identification and potential remediation of assessed risks, performing an annual policy review and retaining all evidence of reviews as performed. This position will assist the CISO to gather information, monitor systems, research solutions, identify risks and recognize problems.

Essential Duties and Responsibilities
Assists with the development and implementation of a robust Information Technology Cybersecurity Program inclusive of state-of-the-art policies and processes that enable the organization to establish consistent, effective information security practices and minimize risk.
Participates in projects and priorities for all information security issues and supports short- and long-range business action plans to achieve the execution of the best practice vision designed by the CISO to secure the institution technical resources and critical data.
Assists the CISO regarding the identification of current and future IT security issues and security program developments. Provides updates to the CISO that may include written and/or in-person presentations on relevant information security topics, results of security risk assessments, and progress against approved corrective action plans.
Attends meetings regarding Critical Incident Management Plans as required by the CISO
Assists the CISO to monitors the institution’s Cybersecurity Program end-user training and testing plans
Assists the CISO to educate employees regarding policies, and best practices. Provides training to staff, faculty and students regarding security protocols and procedures as required.
Monitors and analyzes network security traffic, firewall-based security traffic, email-based security traffic, Internet security traffic, cloud-based security traffic, end-user security traffic, web-based security traffic, application and server-based security traffic, intrusion detection/prevention systems, data loss prevention systems, and security information and event-management systems and provides reports, recommendations and action plans as required under the direction of the CISO.
Promotes the institution’s information security policies designed to ensure the confidentiality, integrity and availability of IT systems and data.
Interacts with the Information Technology department (internal and outsourced personnel) and other departmental leadership to acquire information, operational processes, workflows and documentation regarding the institution’s security posture, preparedness, strengths and weaknesses to provide recommendations regarding action plans, documentation, reporting and potential software, hardware and other acquisitions to improve the security posture of the organization under the direction of the CISO.
Assists the CISO conduct internal security audits to ensure compliance with industry regulations and standards, state requirements and institutional objectives.
Stays current on emerging security threats, solutions and technologies in the cybersecurity field.
Monitors and evaluates system security backup and recovery procedures as directed by the CISO and the VP of Information Technology.
Pursues professional development by taking security related courses, classes, certifications, webinars offered by the College, the State of Texas and/or professional development organizations as directed by the CISO
Participates collegially in discipline-specific activities developed for the Information Technology department as required.
Attends the workplace regularly, reports to work punctually and follows a work schedule to keep up with the demands of the worksite (which may be on campus or at an off-site location).
Safeguards information system assets and maintains confidentiality of security concerns
Reports violations of security policy or best practice to the CISO in the course of business
Assists the CISO complete security audits as required.
Assists the CISO complete security reports as required.
Performs vulnerability scans under the supervision of the CISO as required.
Updates information security and response plan documentation as required.
Familiarizes themselves with the College technology ecosystem as it relates to security information as required.
Attends department meetings and supervisory meetings as required.
Displays superior customer service skills.
Working hours may include evenings or weekends.
Support the values and institutional goals as defined in the College’s Strategic Plan.
Complete duties and responsibilities in compliance with college standards, policies and guidelines.

Required Knowledge and Skills
To perform this job successfully, an individual must be able to perform each essential duty satisfactorily. The requirements listed below are representative of the knowledge, skill, and/or ability required.
Strong, demonstrated commitment to the mission of the community college.
A relatively high level of analytical ability is required. Ability to solve problems requiring analysis regarding relatively complex administrative systems and programs.
Work generally consists of activities, projects, or assignments where decision-making input is expected.
Skill in working effectively in a team environment with a customer service focus.
Ability to use technology as required in the information security field.
Ability to establish and maintain positive and effective working relationships with students, college employees, executive leadership and the public.
Ability to communicate effectively, both orally and in writing; define problems, collect data, establish facts, and draw valid conclusions; and effectively present information.
High level of energy and good sense of humor with the capacity for extraordinary time and effort demands.
Ability to work in a fast-paced environment.
General understanding of cloud-based technologies.

Required Education and Experience
To perform this job successfully, an individual must be able to perform each essential duty satisfactorily. The requirements listed below are representative of the education and experience required.
Bachelor’s degree in Computer Science, Information Security, Cybersecurity or a related field from an accredited college or university.
Minimum of 2 years of experience in information technology/security, with a focus on higher education or public sector environments a plus.
Experience with security architecture, incident response, and risk management.
Experience with security assessment tools and techniques such as vulnerability scanning, penetration testing and threat intelligence analysis.
Experience in collaborating with colleagues across an organization in the construction and continuous improvement of measurable information security outcomes.
Demonstrated excellent communication and interpersonal skills and the ability to work independently.
Ability to handle sensitive and extensive confidential data.
Proficient in the use of email, word processing, spreadsheet and presentation software and use of the Internet to access data, maintain records, generate reports, and communicate with others.

Preferred Education and Experience
Preferred Industry certifications such as CISSP, SANS GIAC or similar security professional specific training and certification
Knowledge of industry security & privacy regulations (e.g., ISO, SOC2, HIPAA, PCI, GDPR)
Higher degree in Computer Science, Information Security, Cybersecurity or a related field from an accredited college or university.

Certificates and Licensures
None required

Physical Demands
The physical demands described here are representative of those that must be met by an employee to successfully perform the essential functions of this job. Reasonable accommodations may be made to enable individuals with disabilities to perform the essential functions. While performing the duties of this job, the employee is frequently required to stand. The employee is occasionally required to walk; sit; use hands to finger, handle, or feel objects, tools, or controls; reach with hands and arms; climb or balance; stoop, kneel, crouch, or crawl; talk or hear; and taste or smell. The employee must frequently lift and/or move up to 10 pounds and occasionally lift and/or move up to 25 pounds. Specific vision abilities required by this job include close vision, distance vision, color vision, peripheral vision, depth perception, and the ability to adjust focus.

Work Environment
The work environment characteristics described here are representative of those an employee encounters while performing the essential functions of this job. While performing the duties of this job, the employee occasionally works near moving mechanical parts. The noise level in the work environment is usually moderate.
Notes: The duties listed are intended only as illustrations of the various types of work that may be performed. The omission of specific statements of duties does not exclude them from the position if the work is similar, related or a logical assignment to the position. The job description does not constitute an employment agreement between the employer and employee and is subject to change by the employer as the needs of the employer and requirements of the job change.
Reasonable accommodations may be made to enable individuals with disabilities to perform the essential duties and responsibilities.

Posting Detail Information
Posting Number
2024119TSC

Open Date
07/29/2024

Close Date

Open Until Filled
Yes

Special Instructions Summary
Transcripts (unofficial) are required to be attached to applications for all positions with an educational requirement (Faculty/Staff/Administrative).

Your application is not considered complete until all required documents have been attached.

Attachments must be in PDF or Microsoft Word format and must be no larger than 2 MB.

You will not be able to attach documents after your application has been submitted.

Please Note: Official transcripts are only required if recommended for hire. Please Note: Official transcripts are only required if recommended for hire.

Official transcripts shall be sent directly from the issuing institution to the College District’s Office of Human Resources and must include documentation of all credit earned, including the education requirements that specifically qualifies the applicant for the position. The address to send all transcripts is:

Texas Southmost College
Office of Human Resources
80 Fort Brown, Tandy 105
Brownsville, Texas 78520

For eTranscripts please use email address: cristina.garcia@tsc.edu

The College District recognizes equivalent credits and degrees earned from foreign universities. The equivalency shall be determined by translation and evaluation from a member of the National Association of Credential Evaluation Services (NACES). For more information please visit: www.naces.org.",Cyber Security Specialist,Unknown,,,
